[{"container-title":"Human Brain Mapping","author":[{"given":"Elise","family":"Bannier"},{"given":"Gareth","family":"Barker"},{"given":"Valentina","family":"Borghesani"},{"given":"Nils","family":"Broeckx"},{"given":"Patricia","family":"Clement"},{"given":"Kyrre E.","family":"Emblem"},{"given":"Satrajit","family":"Ghosh"},{"given":"Enrico","family":"Glerean"},{"given":"Krzysztof J.","family":"Gorgolewski"},{"given":"Marko","family":"Havu"},{"given":"Yaroslav O.","family":"Halchenko"},{"given":"Peer","family":"Herholz"},{"given":"Anne","family":"Hespel"},{"given":"Stephan","family":"Heunis"},{"given":"Yue","family":"Hu"},{"given":"Chuan‐Peng","family":"Hu"},{"given":"Dorien","family":"Huijser"},{"given":"María","family":"Iglesia Vayá","non-dropping-particle":"de la"},{"given":"Radim","family":"Jancalek"},{"given":"Vasileios K.","family":"Katsaros"},{"given":"Marie‐Luise","family":"Kieseler"},{"given":"Camille","family":"Maumet"},{"given":"Clara A.","family":"Moreau"},{"given":"Henk‐Jan","family":"Mutsaerts"},{"given":"Robert","family":"Oostenveld"},{"given":"Esin","family":"Ozturk‐Isik"},{"given":"Nicolas","family":"Pascual Leone Espinosa"},{"given":"John","family":"Pellman"},{"given":"Cyril R","family":"Pernet"},{"given":"Francesca Benedetta","family":"Pizzini"},{"given":"Amira Šerifović","family":"Trbalić"},{"given":"Paule‐Joanne","family":"Toussaint"},{"given":"Matteo","family":"Oleggio Castello","non-dropping-particle":"Visconti di"},{"given":"Fengjuan","family":"Wang"},{"given":"Cheng","family":"Wang"},{"given":"Hua","family":"Zhu"}],"DOI":"10.1002/hbm.25351","type":"article-journal","id":"Bannier_2021","citation-key":"Bannier_2021","ISSN":"1097-0193","issue":"7","issued":{"date-parts":[[2021,2]]},"page":"1945-1951","publisher":"Wiley","title":"The Open Brain Consent: Informing research participants and obtaining consent to share brain imaging data","URL":"http://dx.doi.org/10.1002/hbm.25351","volume":"42","_graph":[{"type":"@biblatex/text","data":" @article{Bannier_2021, title={The Open Brain Consent: Informing research participants and obtaining consent to share brain imaging data}, volume={42}, ISSN={1097-0193}, url={http://dx.doi.org/10.1002/hbm.25351}, DOI={10.1002/hbm.25351}, number={7}, journal={Human Brain Mapping}, publisher={Wiley}, author={Bannier, Elise and Barker, Gareth and Borghesani, Valentina and Broeckx, Nils and Clement, Patricia and Emblem, Kyrre E. and Ghosh, Satrajit and Glerean, Enrico and Gorgolewski, Krzysztof J. and Havu, Marko and Halchenko, Yaroslav O. and Herholz, Peer and Hespel, Anne and Heunis, Stephan and Hu, Yue and Hu, Chuan‐Peng and Huijser, Dorien and de la Iglesia Vayá, María and Jancalek, Radim and Katsaros, Vasileios K. and Kieseler, Marie‐Luise and Maumet, Camille and Moreau, Clara A. and Mutsaerts, Henk‐Jan and Oostenveld, Robert and Ozturk‐Isik, Esin and Pascual Leone Espinosa, Nicolas and Pellman, John and Pernet, Cyril R and Pizzini, Francesca Benedetta and Trbalić, Amira Šerifović and Toussaint, Paule‐Joanne and Visconti di Oleggio Castello, Matteo and Wang, Fengjuan and Wang, Cheng and Zhu, Hua}, year={2021}, month=feb, pages={1945–1951} }\n"},{"type":"@biblatex/entries+list"},{"type":"@csl/list+object"}]}]